,thread_id,thread_title,thread_link,thread_author,thread_startDate,thread_replies,thread_views,post_id,post_username,post_userTitle,post_userNbMessages,post_userLikesReceived,post_userTrophyPoints,post_DateTime,post_like,post_agree,post_useful,post_funny,post_informative,post_friendly,post_optimistic,post_hug,post_number,post_messageText,post_quoteText
66703,thread-129663,Anxious about reducing sugars...,https://www.diabetes.co.uk/forum/threads/anxious-about-reducing-sugars.129663/,Mootie,"Nov 19, 2017",16,"1,004",post-1624841,Boo1979,Other Well-Known Member,"1,852","1,064",198.0,"Nov 20, 2017 at 12:17 PM",0,0,0,0,0,0,0,0,#11,"Mine came out as milk, eggs, tomatoes ( and other members of the nightshade food family which includes spuds) , carrots, corn white ( but not wholemeal) flour, sugar and beef. At the time there was stuff in the literature I read re food intolerances about a possible link between food intolerance and later development of diabetes. When I asked about this when I was diagnosed with diabetes some 15 years later, the consultant basically told me not to be stupid EDIT - missed white (but not brown) rice off the list of things I reacted to","Kristin251 said: As @Boo1979 said, food intolerances can play a big role in weight gain/ loss. The foods that make me gain/nontoxic lose are all grains and starches ( carbs in general) all dairy, too many nuts and too much food in general. I am not coeliac but I am very grain intolerant. All grains. Dairy as well. Saturated fats make me gain. Mediterranean fats make me lose. AvocDo, olive oil, olives, mayo. Click to expand..."
141742,thread-74317,Safe fruit,https://www.diabetes.co.uk/forum/threads/safe-fruit.74317/,davidob,"Mar 26, 2015",45,"22,425",post-964691,JenniferW,Type 2 Well-Known Member,500,"1,002",158.0,"Oct 9, 2015 at 10:10 AM",0,0,0,0,0,0,0,0,#45,"Interesting .... someone on my EXPERT course, who'd had his BG controlled by diet and exercise for around 10 years by diet and exercise, told me to test the difference according to how soon after eating I did exercise. He's a retired doctor, so I think I'll try this, too. I'm doing an hour's walking a day (almost up to the 10,000 steps daily average), but now I realise the timing of it can also help.","Linda_Aniolkowski_ said: I eat 2 pieces of fruit a day which was suggested to me by my diabetic dietician, and it varies from apple, melon, water melon, kiwi, orange, hard pear. These fruits do not seem to interfere with my diabetis, I must add that I also do one hour of walking on a daily basis. Click to expand..."
22295,thread-158810,should i check my blood sugar after walking ?,https://www.diabetes.co.uk/forum/threads/should-i-check-my-blood-sugar-after-walking.158810/,Charis1213,"Nov 23, 2018",53,"1,855",post-1928233,JoKalsbeek,Type 2 (in remission!) Well-Known Member,"1,665","1,598",178.0,"Nov 24, 2018 at 4:51 PM",1,1,0,0,0,0,0,0,#31,"You did it right with the meat, fish and greens. That's all fine, it was the cobbler that was problematic. Anything made with dough or fruit or something will be high in carbs, and that does add up to the numbers you experienced. (Without the walk they probably would've been higher, so that walk was a good call!) I've tried antidepressants since I was 13 years old. They gave me migraines every single day for little over a year. (My shrink called me an obstinate quitter. I was puking my brains out daily, couldn't go to school...). Also, something that wasn't known then, in the time where prozac was still hailed as a miracle-drug: kids in puberty get more suicidal on prozac. That stuff made me very positive about death. I barely survived that, and have the hospitalrecords to prove it. Later, as an adult, I tried anti-depressants again, with various medicatons. When I finally found one that didn't give me migraines and allowed me to sleep, my eyesight got worse. My eyes hurt like heck. And then I found out my rheumatologist never put on record that I have Sjgrens, because I never should've been put on that antidepressant because it could've cost me the use of my eyes. And that's just the antidepressants. (So yes, probably like you, I'm hanging on by my fingernails as a way of life.) I'm extremely susseptable to side-effects, to any medication, so you can guess what happened on metformin: I lived in the loo for weeks. That's when I went searching for an alternative and found low carb. I wasn't as high as you, but there's T2's out there who were on insulin, and could stop that because of a low carb diet. So I totally get where you're coming from, and yeah, a low carb (not low-ish, but proper low carb!), can help you, in a way where there could very well be no meds required. Can't guarantee anything, but the odds are with you on this one. Don't give up just yet.","Charis1213 said: I'm going to do that diet from the diet doctor, am I still able to reverse ths or have i gone too far now my hba1c last week was 105 , and thats when i started cutting out processed foods , i felt immediately better and lost six pounds in six days , I want to reverse this cos I can't live with this anxiety. My phobia of medications is side effects i had adverse affects with depression tablets a few years back and i received therapy for other mental issues but the medication phobia is still there so I need to do without medication . Click to expand..."
96183,thread-116711,GPs/Diabetic Nurses Unilaterally Changing Patients' Blood Glucose Meters,https://www.diabetes.co.uk/forum/threads/gps-diabetic-nurses-unilaterally-changing-patients-blood-glucose-meters.116711/,DavidDK,"Feb 22, 2017",5,642,post-1392533,DavidDK,Type 1 Newbie,4,0,41.0,"Feb 22, 2017 at 10:32 AM",0,0,0,0,0,0,0,0,#3,"Thanks for your reply Lovinglife I hadn't realised clinical commissioning groups have been implementing such measures to save money. It seems to me that this is a battle I am unlikely to win. I see from the internet that there are numerous varying accounts about whether the new meter I have been prescribed is as accurate relative to the meter I have been using these past years. However, at the end of the day, the price of the test strips for the new meter is significantly cheaper than my existing meter. I now have concerns that in future my attending clinicians will change my medication, which is relatively new and therefore relatively expensive, not for any clinical benefit to me, but in order to save money and balance budgets. That I do care about, particularly as my diabetes is now under control.",
44921,thread-143376,Insulin in hot countries,https://www.diabetes.co.uk/forum/threads/insulin-in-hot-countries.143376/,m.olly,"Apr 22, 2018",1,226,post-1760209,Alasdair,Type 1 Well-Known Member,140,115,83.0,"Apr 22, 2018 at 8:39 PM",0,0,0,0,0,0,0,0,#2,Get a frio pack/wallet,
212983,thread-35080,"What type of diabetes do you have, and do you work?",https://www.diabetes.co.uk/forum/threads/what-type-of-diabetes-do-you-have-and-do-you-work.35080/,Administrator,"Nov 19, 2012",108,"61,642",post-336274,sparkster,Member,7,0,21.0,"Dec 12, 2012 at 8:49 PM",0,0,0,0,0,0,0,0,#33,"i've been type 1 for 4 yrs and work as a fencing contractor, work is pretty physical and a very long day which has meant that pretty much from week 2 after diagnosis i havn't had to inject in the mornings or at lunchtime even though i'm eating quite alot of carbs, not sure whether or not this is a good thing! Hba1c's stable at 7!",
130431,thread-96409,Post Gastric Bypass.,https://www.diabetes.co.uk/forum/threads/post-gastric-bypass.96409/,1962alison,"Mar 1, 2016",4,"1,256",post-1083449,daisy1,Type 2 Legend,"26,460","4,870",248.0,"Mar 2, 2016 at 6:42 AM",0,0,0,0,0,0,0,0,#5,"@1962alison Hello Alison and welcome to the forum To help you with your blood sugar levels, here is the information we give to new members and I hope it will be useful to you. BASIC INFORMATION FOR NEW MEMBERS Diabetes is the general term to describe people who have blood that is sweeter than normal. A number of different types of diabetes exist. A diagnosis of diabetes tends to be a big shock for most of us. Its far from the end of the world though and on this forum youll find over 150,000 people who are demonstrating this. On the forum we have found that with the number of new people being diagnosed with diabetes each day, sometimes the NHS is not being able to give all the advice it would perhaps like to deliver - particularly with regards to people with type 2 diabetes. The role of carbohydrate Carbohydrates are a factor in diabetes because they ultimately break down into sugar (glucose) within our blood. We then need enough insulin to either convert the blood sugar into energy for our body, or to store the blood sugar as body fat. If the amount of carbohydrate we take in is more than our bodys own (or injected) insulin can cope with, then our blood sugar will rise. The bad news Research indicates that raised blood sugar levels over a period of years can lead to organ damage, commonly referred to as diabetic complications . The good news People on the forum here have shown that there is plenty of opportunity to keep blood sugar levels from going too high. Its a daily task but its within our reach and its well worth the effort. Controlling your carbs The info below is primarily aimed at people with type 2 diabetes, however, it may also be of benefit for other types of diabetes as well. There are two approaches to controlling your carbs: Reduce your carbohydrate intake Choose better carbohydrates Reduce your carbohydrates A large number of people on this forum have chosen to reduce the amount of carbohydrates they eat as they have found this to be an effective way of improving (lowering) their blood sugar levels. The carbohydrates which tend to have the most pronounced effect on blood sugar levels tend to be starchy carbohydrates such as rice, pasta, bread, potatoes and similar root vegetables, flour based products (pastry, cakes, biscuits, battered food etc) and certain fruits. Choosing better carbohydrates Another option is to replace white carbohydrates (such as white bread, white rice, white flour etc) with whole grain varieties. The idea behind having whole grain varieties is that the carbohydrates get broken down slower than the white varieties and these are said to have a lower glycaemic index. http://www.diabetes.co.uk/food/diabetes-and-whole-grains.html The low glycaemic index diet is often favoured by healthcare professionals but some people with diabetes find that low GI does not help their blood sugar enough and may wish to cut out these foods altogether. Read more on carbohydrates and diabetes LOW CARB PROGRAM: http://www.diabetes.co.uk/low carb program Eating what works for you Different people respond differently to different types of food. What works for one person may not work so well for another. The best way to see which foods are working for you is to test your blood sugar with a glucose meter. To be able to see what effect a particular type of food or meal has on your blood sugar is to do a test before the meal and then test after the meal. A test 2 hours after the meal gives a good idea of how your body has reacted to the meal. The blood sugar ranges recommended by NICE are as follows: Blood glucose ranges for type 2 diabetes Before meals: 4 to 7 mmol/l 2 hours after meals: under 8.5 mmol/l Blood glucose ranges for type 1 diabetes (adults) Before meals: 4 to 7 mmol/l 2 hours after meals: under 9 mmol/l Blood glucose ranges for type 1 diabetes (children) Before meals: 4 to 8 mmol/l 2 hours after meals: under 10 mmol/l However, those that are able to, may wish to keep blood sugar levels below the NICE after meal targets. Access to blood glucose test strips The NICE guidelines suggest that people newly diagnosed with type 2 diabetes should be offered: structured education to every person and/or their carer at and around the time of diagnosis, with annual reinforcement and review self-monitoring of plasma glucose to a person newly diagnosed with type 2 diabetes only as an integral part of his or her self-management education Therefore both structured education and self-monitoring of blood glucose should be offered to people with type 2 diabetes. Read more on getting access to bloodglucose testing supplies . You may also be interested to read questions to ask at a diabetic clinic Note: This post has been edited from Sue/Ken's post to include up to date information.",
213807,thread-36357,Diabetic Friendly take-away,https://www.diabetes.co.uk/forum/threads/diabetic-friendly-take-away.36357/,DeeMarks,"Jan 7, 2013",35,"9,449",post-342748,MelissaZT,Type 1 Newbie,1,0,21.0,"Jan 18, 2013 at 12:07 PM",0,0,0,0,0,0,0,0,#21,"Hi everyone, I've just joined the forum and found the Diabetic friendly take-away chat a really big eye opener! I've had Type 1 Diabetes since I was 11, I'm now 23 and I'm a fitness/dance instructor so I'm extremely active but I do enjoy a good take-away! I enjoy anything from a McDonalds or KFC to an Indian meal or my favourite - Nandos! I have large protions due to the amount of calories I burn (and I always have a huge appetite!) and although I don't have take-away's often I always have quite large portions of food for my evening meal. I do have small breakfasts, lunches and snacks which include fruit, veg and fish when I have time to cook it but reading your comments has made me realise maybe I should change my take-away habits... I like to have chocolate or a milshake when I go to the cinema too as I'm sure most people will, could all of this be doing more damage than I've realised...??? Thanks in advance for any replies",
171587,thread-65135,Lower carb on a budget,https://www.diabetes.co.uk/forum/threads/lower-carb-on-a-budget.65135/,donnellysdogs,"Sep 30, 2014",27,"2,110",post-644295,Engineer88,Type 1 Well-Known Member,"2,141","1,446",198.0,"Oct 1, 2014 at 11:11 AM",0,0,0,0,0,0,0,0,#25,Well its a one off offer on locally sourced ingredients including what would normally be really expensive. Might be worth a try for some such as the students at my work. the end of the day its a proper meal and might need a few veggies thrown in but its still cheap (as far as im concerned!),
40527,thread-149697,DIABETES 2 INSULIN QUESTION,https://www.diabetes.co.uk/forum/threads/diabetes-2-insulin-question.149697/,pollensa,"Jun 2, 2018",99,"3,747",post-1799726,Alexandra100,Prefer not to say Well-Known Member,"2,897","1,212",198.0,"Jun 3, 2018 at 7:00 PM",0,1,0,0,0,0,0,0,#85,You can read about Dr B's Laws of Small Numbers here: http://www.diabetes-book.com/laws-small-numbers/,
16901,thread-160697,Blood,https://www.diabetes.co.uk/forum/threads/blood.160697/,chris66,"Jan 27, 2019",33,565,post-1973362,chris66,Type 2 Well-Known Member,141,68,48.0,"Jan 27, 2019 at 9:46 PM",0,0,0,0,0,0,0,0,#22,"May get in touch with Dr, see if i can get them to prescribe a meter and go from there but have a feeling she would most likely say i don't need one.","Tipetoo said: Both Abbot and Accu-Chek meters come with a lancing device, Accu-Chek's FastClix device is better than Abbots though. Click to expand..."
124518,thread-99143,Freestyle Libre,https://www.diabetes.co.uk/forum/threads/freestyle-libre.99143/,bennycrock,"Apr 8, 2016",8,"1,213",post-1122179,DotsDots,Type 1 Member,5,0,41.0,"Apr 9, 2016 at 6:18 PM",0,0,0,0,0,0,0,0,#7,Thanks,
74546,thread-126588,Diabetes Type 2 prevalence - Data References,https://www.diabetes.co.uk/forum/threads/diabetes-type-2-prevalence-data-references.126588/,Tinywren,"Sep 18, 2017",2,459,post-1563878,Alison Campbell,Prediabetes Well-Known Member,"1,448",788,173.0,"Sep 18, 2017 at 1:19 PM",0,0,1,0,0,0,0,0,#2,Hi @Tinywren Yes the rise in type 2 in the last 20 years is really quite surprising. Also looking at prediabetes and people at risk of type 2 in the UK was a real shock I found this report more helpfully referenced https://diabetes-resources-producti...igration/pdf/DiabetesUK_Facts_Stats_Oct16.pdf Found here at https://www.diabetes.org.uk/professionals/position-statements-reports/statistics Updated 2017 reports should be available soon Prediabetes and people edging towards type 2 in the UK http://bmjopen.bmj.com/content/4/6/e005002#block-system-main,
56842,thread-134954,What have you had for your evening meal?,https://www.diabetes.co.uk/forum/threads/what-have-you-had-for-your-evening-meal.134954/,Sean-W,"Feb 1, 2018",32,"1,979",post-1686432,Key_master_,Type 1 Well-Known Member,224,324,83.0,"Feb 1, 2018 at 6:45 PM",2,0,0,0,0,0,0,0,#12,"Low carb chicken masala for me, gave that broccoli, kale and seaweed steamed rice from Iceland a whirl. Was very nice and just under 12g carb. Even had 2 bags, mixed it all together, didnt look that appealing compared to normal rice you would just dollop your sauce over but tasted lovely and was good for me and thats what counts. Heres to another lovely flat line meal.",
232574,thread-25228,Kidney Infection?,https://www.diabetes.co.uk/forum/threads/kidney-infection.25228/,Nekromantik,"Nov 17, 2011",9,"2,178",post-231170,RussG,Well-Known Member,401,2,38.0,"Nov 18, 2011 at 8:27 AM",0,0,0,0,0,0,0,0,#9,Can you see a different doctor in the same practice? I have GPs that I like but one I don't and I can usually avoid him.,
248496,thread-13402,Blood sugar levels,https://www.diabetes.co.uk/forum/threads/blood-sugar-levels.13402/,dabbit,"Feb 22, 2010",8,"2,517",post-122054,dabbit,Type 2 Active Member,35,2,48.0,"Feb 22, 2010 at 4:51 PM",0,0,0,0,0,0,0,0,#1,"OK I admit my diet isn't that of lettuce sandwiches made of brown bread and no butter, but I do find the Diabetes UK guidelines of (not sure if they are the exact amounts): * Between 4-6 * And no more than 10 after meals Unrealistic? My hb1ac has risen from 7.4 to 7.6 although everything else has remained stable. Personally I cannot eat a meal without my BG's going over 10? Does anyone manage to stay within the ranges they suggest? Where am I going wrong?",
184123,thread-58771,Protein,https://www.diabetes.co.uk/forum/threads/protein.58771/,iamhingo,"May 24, 2014",2,463,post-550324,iamhingo,Member,6,0,21.0,"May 24, 2014 at 4:36 PM",0,0,0,0,0,0,0,0,#3,Wow thank you so very much. Thats great information! I can now train knowing my control is not suffering. Thanks again Sent from the Diabetes Forum App,
155071,thread-72312,Acute Tiredness,https://www.diabetes.co.uk/forum/threads/acute-tiredness.72312/,penick,"Feb 19, 2015",20,"1,779",post-774244,penick,Type 2 Member,8,7,43.0,"Feb 19, 2015 at 5:40 PM",0,0,0,0,0,0,0,0,#1,"I would be interested to know if anybody else suffers from the same acute tiredness as I do. I retire each evening around 10.30/11.00pm and I have to say that I sleep very soundly until I awake about 8.00am. You would think that after 9 hours of good sleep I would feel refreshed, but not so. All I want to do is go back to sleep and on occasion I have done just that and slept on until 10.00am. When I then awake, I feel no better and just want to sleep on again. Most mornings however, I struggle to get up at 8.00am and after the usual shower and breakfast if I don't force myself to get up and do something I will fall asleep again in my chair. Is this sort of thing happening to others and if so what would you suggest I do to break the cycle and regain my life. Perhaps I should add that I am 86 years old and was diagnosed T2 six years ago. I am taking 2 x 500mg Metformin each day, along with other medication for a heart condition. I would welcome your observations.",
44612,thread-144186,Advice needed,https://www.diabetes.co.uk/forum/threads/advice-needed.144186/,Sueaug,"Apr 27, 2018",2,328,post-1764686,JohnEGreen,Other Expert,"8,122","18,613",198.0,"Apr 27, 2018 at 10:45 AM",0,1,0,0,0,0,0,0,#2,Yes it may well have you really need to have been eating normal carb diet for some time prior to an OGTT as your reaction to a large amount of carbs at one go after being low carb for a period of time can amplify your reaction to the carbs and cause a much higher and protracted BS spike. Or so I have been told.,
150125,thread-78548,Statins & Blood Pressure,https://www.diabetes.co.uk/forum/threads/statins-blood-pressure.78548/,Rog,"Jun 10, 2015",39,"6,305",post-874258,NoCrbs4Me,I reversed my Type 2 Well-Known Member,"3,692","9,088",198.0,"Jun 11, 2015 at 7:25 PM",2,0,0,0,0,0,0,0,#15,"The first 13 minutes of the documentary ""Statin Nation"": It's worth a watch.",
114501,thread-105605,yogurt greek or otherwise,https://www.diabetes.co.uk/forum/threads/yogurt-greek-or-otherwise.105605/,libbyM,"Aug 2, 2016",4,860,post-1229488,paganlass,Type 2 Well-Known Member,125,50,68.0,"Aug 14, 2016 at 6:11 PM",2,0,0,0,1,0,0,0,#5,"I am t2 diabetic only diagnosed 4 weeks ago and i have already found that I cannot eat porridge at all. I do sometimes have egg, poached but mainly scrambled in a dry non stick pan. But I am now low carb and found I can have full fat Greek yoghurt with a few blueberries and it doesn't affect my bg. I only have 2 tablespoons.",
260377,thread-5957,Normal to have variations in a non-diabetic for no reason?,https://www.diabetes.co.uk/forum/threads/normal-to-have-variations-in-a-non-diabetic-for-no-reason.5957/,JJ4,"Jan 29, 2009",3,655,post-48605,JJ4,Well-Known Member,52,0,26.0,"Jan 29, 2009 at 9:03 PM",0,0,0,0,0,0,0,0,#3,"Thanks for the reply, sue. I honestly am not concerned, his few fasting ones have been fine - usually around 5.5 or below and I don't want to get into the cycle of testing regularly just because, that's when the neurosis and worry sets in and at this point, I am not worried - more curious. I refuse to analyse a handful of readings too deeply but knew you wise ones would be able to offer an opinion! I will probably get my daughters health issues sorted first and keep an eye on my son or obviously if anything drastically changes I'll hot foot it to the GP with him.",
73722,thread-124467,Hba1c test result,https://www.diabetes.co.uk/forum/threads/hba1c-test-result.124467/,Leamill,"Aug 2, 2017",56,"3,880",post-1530431,Fleegle,Type 2 Well-Known Member,776,942,153.0,"Aug 11, 2017 at 11:27 AM",0,1,0,0,0,0,0,0,#44,"I wonder how many people ""released"" would still be active on this programme. I am sure @Pipp was offered the chance to be de-listed but turned it down though I could be confused on who posted that.","Leamill said: Am I the only one that has been totally released from the program.Is there any one in this forum that was diabetic and treated as a diabetic only to find out you were never had diabetes, and that's OK with them. Click to expand..."
16741,thread-160566,Chia seeds,https://www.diabetes.co.uk/forum/threads/chia-seeds.160566/,Motherhen2014,"Jan 23, 2019",47,"2,053",post-1970171,Chook,Type 2 Well-Known Member,"4,290","6,060",198.0,"Jan 24, 2019 at 10:04 AM",0,0,0,0,0,0,0,0,#21,"Also sell them, too. I like them best soaked for a few hours (minimum 4 hours) in unsweetened Almond milk then add some vanilla and some unsweetened coconut cream. Stir lots. Tastes quite a lot like rice pudding.",
127951,thread-97015,Can I do a low carb high fat diet with high cholesterol?,https://www.diabetes.co.uk/forum/threads/can-i-do-a-low-carb-high-fat-diet-with-high-cholesterol.97015/,JoeyK,"Mar 9, 2016",6,"1,824",post-1091725,carol43,Type 2 (in remission!) Well-Known Member,"1,004","1,220",198.0,"Mar 9, 2016 at 7:38 PM",2,0,0,0,0,0,0,0,#2,"Suggest you watch this video, Prof Sikaris talks are really good.",
177744,thread-61553,Its OK saying about hb1ac,https://www.diabetes.co.uk/forum/threads/its-ok-saying-about-hb1ac.61553/,rinfrance,"Jul 17, 2014",29,"2,755",post-591660,AndBreathe,I reversed my Type 2 Expert,"9,664","15,724",178.0,"Jul 19, 2014 at 1:26 AM",2,0,0,0,0,0,0,0,#20,"Alternatively, and more cheaply, Diastix work well, with just a quick dip and wait 30 seconds. I mean, Diastix aren't much use for urine testing..........",Brunneria said: Definitely some sample tests needed. I love a good experiment! Click to expand...
