,thread_id,thread_title,thread_link,thread_author,thread_startDate,thread_replies,thread_views,post_id,post_username,post_userTitle,post_userNbMessages,post_userLikesReceived,post_userTrophyPoints,post_DateTime,post_like,post_agree,post_useful,post_funny,post_informative,post_friendly,post_optimistic,post_hug,post_number,post_messageText,post_quoteText
55309,thread-135598,Can a lack of carbs be causing my constipation?,https://www.diabetes.co.uk/forum/threads/can-a-lack-of-carbs-be-causing-my-constipation.135598/,Sean-W,"Feb 7, 2018",29,"2,466",post-1691827,ringi,Type 2 Well-Known Member,"3,095","1,147",158.0,"Feb 7, 2018 at 6:02 PM",2,0,0,0,0,0,0,0,#9,"Also increase your salt intake a little, e.g. a stock cube in a mug of water two times a day. In the first few weeks of a low carb diet, our body needs more salt, and due to stopping eating processed food people often reduce salt when they start low carb.... (Unless your body is very ""water logged"" and hence for example you are on tablets to lower BP)",
81612,thread-123655,Eyesight Failing. Please help,https://www.diabetes.co.uk/forum/threads/eyesight-failing-please-help.123655/,Miss316,"Jul 17, 2017",7,593,post-1510887,noblehead,Type 1 Guru,"23,635","19,635",278.0,"Jul 17, 2017 at 5:48 PM",0,1,0,0,0,0,0,0,#7,"There are supplements that are targeted at people with sight issues, but whether they are beneficial or not is debatable. I once asked my Ophthalmologist for a supplement recommendation and they didn't really recommend one, simply saying that a diet rich in veg & fruit would provide all the nutrients and antioxidants to aid eye health. As said the best thing your mum could do is to get her diabetes under control, it's also important to keep bp and cholesterol levels under control when someone has diabetes related eye conditions, it says all this and much more in the following website: http://www.diabeticretinopathy.org.uk/Information_for_patients.html# Best wishes.","Miss316 said: . I am researching all I can to try and find something, anything that will improve and maintain her vision. If anyone knows of any supplements etc please let me know. Thank you. Click to expand..."
156885,thread-71792,How much fat,https://www.diabetes.co.uk/forum/threads/how-much-fat.71792/,AnnieC,"Feb 10, 2015",46,"2,931",post-763101,sanguine,Type 2 Well-Known Member,"3,341","9,632",178.0,"Feb 10, 2015 at 10:08 AM",2,0,0,0,0,0,0,0,#2,"Why should it not be Annie? Our ancestors evolved in a world where they would hunt and eat fatty meat, eggs where they could find them etc. Would nature/God (delete as appropriate) have allowed a system in which fat consumption was bad for you?",
228100,thread-28098,Not taking this seriously!,https://www.diabetes.co.uk/forum/threads/not-taking-this-seriously.28098/,Rachel1569,"Mar 28, 2012",2,711,post-259956,sweetLea,Well-Known Member,108,0,36.0,"Mar 28, 2012 at 11:41 PM",0,0,0,0,0,0,0,0,#3,"What do your parents think about all this? Is the child's father any help? Have you tried getting your sister to look at pictures of diabetic leg ulcers or other diabetic complications? Harsh, I know but sometimes it takes something horrible to make some people realise what is going on. I hope this will all work out ok in the end.",
98814,thread-115522,Helping diagnosed family members?,https://www.diabetes.co.uk/forum/threads/helping-diagnosed-family-members.115522/,PenfoldAPD,"Jan 31, 2017",16,690,post-1372130,PenfoldAPD,Type 2 Well-Known Member,"1,643","5,583",178.0,"Jan 31, 2017 at 7:31 PM",1,0,0,0,0,1,0,1,#3,You are very kind @bulkbiker and a good friend. Thank you. I'll give him a few days then go see him at the weekend.,bulkbiker said: I would just show him your results and tell him what you did to achieve them. After all you are now an unmedicated diet controlled Type 2 so who could be a better example? Click to expand...
75744,thread-125978,Best Performance/Cost Glucometer? (USA),https://www.diabetes.co.uk/forum/threads/best-performance-cost-glucometer-usa.125978/,TikPandora,"Sep 5, 2017",12,"1,045",post-1552925,tim2000s,Type 1 Expert,"8,893","11,788",198.0,"Sep 6, 2017 at 9:57 AM",0,0,0,0,0,0,0,0,#10,@TikPandora - This Diabetes Technology Society paper identifies meter accuracy and also has a table showing cost per strip. Worth a look. http://sites.bu.edu/bionicpancreas/...rs-Ekhlaspour-J-Diabetes-Sci-Technol-2016.pdf The meter that came top was the Contour Next.,
42071,thread-146370,"I’ve done it once, can I do it again?",https://www.diabetes.co.uk/forum/threads/i%E2%80%99ve-done-it-once-can-i-do-it-again.146370/,KerrieMorrison,"May 13, 2018",9,577,post-1779572,NicoleC1971,Type 1 Well-Known Member,"1,239",887,173.0,"May 13, 2018 at 1:36 PM",0,3,0,0,1,0,0,0,#7,Your question implies that it was tough to do it first time around ? How about trying low carb or fasting but doing it with a mindset that this is my lifestyle from now on. If you make changes that you can stick to (because you are not hungry or craving sweet stuff) then you will not be so easily derailed when something difficult happens like that injury or any of the other things that can and do happen to people. The fact that 'feeling sorry for yourself' led to a junk binge tells me that your regime wasn't right for you before because you could not stick to it indefinitely. Whatever you do next should work in the long term otherwise you will be yo yoing around/falling on and off waggons too much. Try LCHF in your own way and keep checking the bgs to motivate you but also ask yourself things like How are my energy/hunger levels?/Cravings etc. to find the right way to do it for you. The short answer is Yes You Can!,
85969,thread-121440,Hypos after each meal,https://www.diabetes.co.uk/forum/threads/hypos-after-each-meal.121440/,Rocky Racoon,"May 30, 2017",12,"1,183",post-1475594,Tony337,Type 1 Well-Known Member,563,916,153.0,"May 31, 2017 at 8:52 AM",1,0,0,0,0,0,0,0,#6,Does he run around like an 8 year old after eating? Tony,
136690,thread-89287,no meds,https://www.diabetes.co.uk/forum/threads/no-meds.89287/,redhead57,"Dec 17, 2015",4,690,post-1011343,redhead57,Type 2 Newbie,1,0,41.0,"Dec 17, 2015 at 11:19 PM",0,0,0,0,0,0,0,0,#1,Hi all. i'm a newbie on here and newly diagnosed t2. i had my first blood test in over a year and the hba1 i think was 69. i am on a Amlodipine 10mg daily for high blood pressure. COPD asthma etc. my GP put me on Metformin 500 mg 2x daily. and ramipril 2.5 1daily. started on monday. last night tight chest. painful cough. i hate medication at the best of times. and have stopped taking them till i speak to my Doctor. is there another way to deal with this as i don't think i can go down this meds route.,
87338,thread-118564,Long overdue reality check!,https://www.diabetes.co.uk/forum/threads/long-overdue-reality-check.118564/,JayAtkinson,"Mar 30, 2017",8,868,post-1426976,Lorraine1973,Type 1 Well-Known Member,149,297,123.0,"Mar 30, 2017 at 7:42 PM",0,0,0,0,0,0,0,0,#7,Jay asked if anybody else had similar experiences I simply shared my experience. How rude. Keep at it Jay x,
173341,thread-64399,Bit Puzzled,https://www.diabetes.co.uk/forum/threads/bit-puzzled.64399/,jay hay-char,"Sep 13, 2014",32,"1,797",post-632716,this is too difficult two,Don't have diabetes Well-Known Member,852,779,133.0,"Sep 13, 2014 at 6:57 PM",0,0,0,0,0,0,0,0,#21,Sorry that is your signature.,this is too difficult two said: Twitt twoo? Click to expand...
100085,thread-115082,Diabetic or have reactive hypo??? Or do they go hand in hand?,https://www.diabetes.co.uk/forum/threads/diabetic-or-have-reactive-hypo-or-do-they-go-hand-in-hand.115082/,dan1jess2,"Jan 22, 2017",13,799,post-1363807,kokhongw,I reversed my Type 2 Well-Known Member,"2,205","1,608",198.0,"Jan 23, 2017 at 7:22 AM",0,1,0,0,0,0,0,0,#9,"Some of us connected the dots all the way back to our teenage years...this experience of reactive hypo...and we are now nearing fifty/sixty etc...we find that a carbs lite fats friendly diet greatly reduces our postmeal insulin response and subsequent reactive hypo episodes. This insulin response classification by Dr Joseph Kraft may help provide you with further insights on the progression from reactive hypo, impaired glucose tolerance to being fully clinically T2D. https://intensivedietarymanagement.com/understanding-joseph-kraft-diabetes-in-situ-t2d-24/",dan1jess2 said: If your have reactive hypo do you also have diabetes do they go hand in hand? Click to expand...
249015,thread-12816,Confused...,https://www.diabetes.co.uk/forum/threads/confused.12816/,ditzeeblonde,"Jan 26, 2010",3,760,post-117493,lilibet,Well-Known Member,515,7,38.0,"Jan 26, 2010 at 9:48 PM",0,0,0,0,0,0,0,0,#4,"Time will tell if its illness - release of stress hormones block insulin from working, which is of course double whammy if you are already resistant Some people swear by a snack at night - slow release carbs such as oatcake and cheese, or just cheese or nuts in order to combat Dawn Phenomenon so maybe try that. Also, do you need to introduce some Met or medication? Or change meds? No shame in it :lol: I totally understand T2 reluctance if you can manage on D and E but as T1 who would kick the bucket without insulin........",
190483,thread-54744,Forced to put up with bad meter/strips - what can I do?,https://www.diabetes.co.uk/forum/threads/forced-to-put-up-with-bad-meter-strips-what-can-i-do.54744/,Anonymous Question,"Mar 17, 2014",3,"1,139",post-503780,))Denise((,Type 2 Well-Known Member,"1,579",496,123.0,"Mar 17, 2014 at 11:16 AM",0,0,0,0,0,0,0,0,#3,The Glucolab meter is rubbish. It reads way higher than my One Touch one. I tested it with the same drop of blood. This could be a problem when driving (I'm on gliclazide). I'm seeing my GP tomorrow and will mention it. I had a choice of 4 meters but they didn't have any Wavesense Jazz in stock.,
132858,thread-92322,I have a bad cold,https://www.diabetes.co.uk/forum/threads/i-have-a-bad-cold.92322/,andyolly,"Feb 9, 2016",5,689,post-1056746,andyolly,Type 2 Active Member,41,163,73.0,"Feb 9, 2016 at 6:35 AM",0,0,0,0,0,0,0,1,#1,"I am not saying its Man Flu. I just have a cold. I generally control my blood sugar levels really well with diet,exercise. Can someone please tell me why after dinner it was 8.7 and this morning its 8.3. What's coursed this and how can I lower",
76046,thread-125877,NHS advice on low carbohydrate diets,https://www.diabetes.co.uk/forum/threads/nhs-advice-on-low-carbohydrate-diets.125877/,TwoRivers,"Sep 2, 2017",37,"3,005",post-1550593,TwoRivers,Type 2 Active Member,43,55,58.0,"Sep 3, 2017 at 4:11 PM",0,0,0,0,0,0,0,0,#24,Good for you! Have you tried alerting the Wiki administrators to this? And also weighing in (no pun intended) on the discussion page? It sounds as if something is definitely wrong. Wiki allows all points of view to be expressed and will lock a page if it thinks this is being interfered with.,Resurgam said: I added information about diabetes control and this forum to the Atkins diet info on Wiki a few hours ago - it is now gone. Maybe if they got a few thousand people all putting the same information and link onto the page they might start to change their minds about low carb being fad diet. Click to expand...
109346,thread-109783,Knee replacement and Diabetes 2 on insulin,https://www.diabetes.co.uk/forum/threads/knee-replacement-and-diabetes-2-on-insulin.109783/,Nadya123,"Oct 18, 2016",6,"1,140",post-1283128,HazelD,Type 2 Well-Known Member,174,351,103.0,"Oct 21, 2016 at 9:57 PM",0,0,0,0,0,0,0,0,#6,Yes I had a knee replacement and am T2. Not a problem I had to wait about 5 hours before my op...didn't have any food but could drink water..they took my blood G and it was well within their limits... nothing to worry about.,"catherinecherub said: There is a lady I recall who had a knee replacement. I will tag her in the hope that she will reply. @HazelD , another member too @Patricia21 This is a thread about her operation http://www.diabetes.co.uk/forum/threads/replacement-knee.71610/ You will see in the thread that other members have had this operation. Click to expand..."
239168,thread-20361,Can Type 1 diabetes impact your sperm count?,https://www.diabetes.co.uk/forum/threads/can-type-1-diabetes-impact-your-sperm-count.20361/,alex200274,"Mar 29, 2011",3,"9,721",post-185206,JUSTFOCUS,Well-Known Member,354,10,38.0,"Mar 29, 2011 at 2:33 PM",0,0,0,0,0,0,0,0,#3,Hi Alex if you and your partner are focusing on conception too much it may be that either of you are trying to hard . If its possible to have some theraputic help .As stress or anxiety combined with medication is a low count .You both will get there and i reckon it will surprise you when it does good luck both JF,
215743,thread-35838,Blood glucose reading 12.6,https://www.diabetes.co.uk/forum/threads/blood-glucose-reading-12-6.35838/,yoda,"Dec 17, 2012",5,"31,118",post-337087,hanadr,Expert,"8,157",332,103.0,"Dec 17, 2012 at 12:21 PM",0,0,0,0,0,0,0,0,#4,"12.6 is too high for a safe consistent reading, but not an emergency! I suspect there are a few carbs hiding in your diet. How about keeping a food diary for a week and noting down the daily readings and times you do them? If you weigh your food, you can analyse EXACTLY what you eat by using on-line data. It's a bit arduous, but a week may show you what's happening and it's not for long. Hana",
15500,thread-160793,If we all Went for a Meal Out Together Where Would  it Be?,https://www.diabetes.co.uk/forum/threads/if-we-all-went-for-a-meal-out-together-where-would-it-be.160793/,Listlad,"Jan 30, 2019",61,"1,780",post-1975632,JoKalsbeek,Type 2 (in remission!) Well-Known Member,"1,665","1,598",178.0,"Jan 30, 2019 at 12:45 PM",0,0,0,0,0,0,0,0,#7,"Difficult? Not really... Bit of a chore sometimes, but I check menu's online and then add it to the experience: call it anticipation. We don't have a Nando's here, but yeah, anywhere where there's loads of meat, fish, poultry or veggies... Grill restaurants, Argentine, tapas places, buffets (pick'n'choose what's suitable). Most of the time you can eat anywhere, if you just tell them to hold the spuds or bread, and replace it with extra vegetables or salad. They'd rather alter a dish than throw out perfectly good food.",Listlad said: An impossibility I know. Fish and Chips? A light hearted slant on things I suppose. But I suppose in truth it is difficult to find places to eat out that would be compatible with our requirements? Click to expand...
56228,thread-160315,Hunger and insulin,https://www.diabetes.co.uk/forum/threads/hunger-and-insulin.160315/,SB.25,"Jan 16, 2019",15,550,post-1964112,kitedoc,Type 1 Well-Known Member,"4,566","3,226",198.0,"Jan 16, 2019 at 10:55 AM",0,0,0,0,0,0,0,0,#9,"Hi @SB.25 , Sorry to hear your life has become more complicated. As a T1D, not as professional advice or opinion: do you have a glucose meter to monitor your blood sugar levels (BSLs) ? That way you can gauge what the addition of this long-acting insulin is doing to your BSLs. If not, since you are prescribed insulin, I believe the GP can order the strips and meter for you - but I bow to others' experience on this. (I assume you live in the UK) As the nurse mentioned, the insulin you are now taking could lower your BSLs. If you go to the Home page and Type 1 diabetes there is a topic called hypoglycaemia (hypo- = low, -gly- glucose, -aemia - in the blood, or hypo for short). You will see that hunger can be a symptom of hypos , so ideally doing a glucose meter reading (from a drop of blood gained by fingerprick) at the time of feeling hungry, or most hungry can give you an idea about whether your BSL is low or not. Definition of low BSL is a reading of either less than 4 mmol/l or less than 3.6 mmol/l. Sometimes people experience feelings of a hypo at higher readings like 5 or even 6 so if you are not sure you could always repeat the test say 10 minutes later. The article on hypoglycaemia also mentions what to do in a hypo, if you should ever experience symptoms as well and have a low reading. There are a number of long-acting insulins: one lasts in its BSL-lowering effect for 12 to 20 hours or so, another for 20 to 24 hours, and others longer. A number of these have a fairly even effect on BSL over the time they work for but others can tend to have a mild peak on BSL-lowering ability partway through the time they are active. If your insulin has such a peak, that may tend to be the time when a low BSL may be more likely to occur. So please let us know here what insulin you have ben prescribed and ask your DSN what effect your particular insulin is likely to have on your BSLs in terms of time after its injection. As others have suggested you will need to wait for the blood test results before knowing more about whether insulin is the best next thing or some other treatment. Best Wishes",
170036,thread-65421,how important diabeties can be,https://www.diabetes.co.uk/forum/threads/how-important-diabeties-can-be.65421/,cath99,"Oct 7, 2014",44,"2,657",post-647648,cath99,Type 2 Well-Known Member,619,734,133.0,"Oct 7, 2014 at 12:06 PM",0,0,0,0,0,0,0,0,#5,"i have tried to get him and gave him advice from guys here to, sadly the denial never left him here but hopefully after this he will listen sad to think it could of been prevented tho .. x","zand said: Yes, what jack said! Perhaps your friend might let us help him at last when he is over the operation? Click to expand..."
88888,thread-119793,Tinned fruit & Double Cream,https://www.diabetes.co.uk/forum/threads/tinned-fruit-double-cream.119793/,wiseowl_123,"Apr 22, 2017",16,"1,826",post-1447518,Bluetit1802,Type 2 (in remission!) Guru,"24,059","30,031",298.0,"Apr 23, 2017 at 2:55 PM",3,0,0,0,0,0,0,0,#11,"Oh yes, tinned salmon butties were always on the menu. I still have the tinned salmon but without the bread!",Debzz_ said: How many of us used to have this ! Also tinned red salmon sandwiches lol Click to expand...
183555,thread-58232,CGM - Continuos Glucose Monitoring,https://www.diabetes.co.uk/forum/threads/cgm-continuos-glucose-monitoring.58232/,sammyc123,"May 13, 2014",15,"1,885",post-544711,lilyfleur,Type 1 Well-Known Member,59,110,73.0,"May 17, 2014 at 4:14 PM",0,0,0,0,0,0,0,0,#7,"Hey Sam, I've been looking into this myself, just sent an email asking for information from Minimed about the costs of theirs and they said: If you're already on the Paradigm Veo insulin pump, you ""just"" need the CGM starter pack which includes a 5 pack of enlite sensors, minilink (which I assume is the part which sends the results to the pump) and an enlite inserter (to insert the sensors). This costs 687. After that, the sensors cost 275 for a pack of 5, or 525 for a pack of 10 and they last around 6 days. From what I've read the Minimed ones aren't very good for lasting longer than the time stated. If you don't have an insulin pump, you'd need the Guardian too (which is basically just a standalone CGM device which your sensors link to instead of to the pump), and the cost to buy the that with the CGM starter kit is 1599 on promotion at the moment (it says it ended on 25th April but they were still running it last week). I'd mentioned in the email that I was concerned it was out of my price range and did they have any suggestions re: funding, and if I decided to go for it did they do any sort of trial period, but they didn't offer any advice on that front unfortunately. Having read more online, it seems the Dexcom is more popular because they're cheaper to run, the sensors last longer and I hear they're more accurate. It seems that some people are able to get CGM funded by their local hospital, but I guess it's just a case of whether you're lucky enough to live in the right area- I can't get it at mine- but I believe it's worth asking. Apparently the best way to go about it is to weigh up the pros and cons, and if CGM could prevent serious hypos (if you have reduced awareness for example) and/or hospital admissions, and/or could save money because you're getting through a ridiculous amount of blood testing strips at present, then it's definitely worth a shot. You have to essentially present a case to them for how CGM could be the most efficient option in your case, and hope that they agree! Also, if you're interested in trialling it out, most hospitals will allow you to loan one just for 6 days, to get a clearer picture of what's going on with your blood sugars. I'd recommend trying that before considering forking out to pay for one if that's what it comes to! Good luck (and let us know how you get on) Sarah",
132066,thread-94740,Artificial sweeteners.,https://www.diabetes.co.uk/forum/threads/artificial-sweeteners.94740/,Mikrobe,"Feb 16, 2016",6,461,post-1067162,ally1,Type 2 Expert,"5,282","21,738",198.0,"Feb 16, 2016 at 5:00 PM",2,0,0,0,0,0,0,0,#4,I use sweetex,
144546,thread-82053,What are reasons for 10 second rule when injecting...,https://www.diabetes.co.uk/forum/threads/what-are-reasons-for-10-second-rule-when-injecting.82053/,Molly56,"Aug 14, 2015",37,"6,175",post-921438,iHs,Well-Known Member,"4,607","2,321",158.0,"Aug 16, 2015 at 12:51 AM",0,0,0,0,0,0,0,0,#30,"@Molly56 Although I now use an insulin pump, I sometimes use an insulin pen if need be. In the 50yrs I've been type 1, I don't think that I've ever done an air shot. I just make sure that I can see a droplet of insulin at the end of the needle, dial up the units I need and theninject. I use a Lilly Humapen Luxura which takes pen cartridges. I also very rarely hold the pen needle in my skin for more than 2-3 secs. It's in and out lol",
34721,thread-154223,Red Wine,https://www.diabetes.co.uk/forum/threads/red-wine.154223/,jayney27,"Jul 19, 2018",21,"2,651",post-1839589,jayney27,Type 2 (in remission!) Well-Known Member,"1,643","3,149",198.0,"Jul 19, 2018 at 8:14 PM",0,1,0,0,0,0,0,0,#15,"Thank you, I appreciate your taking the time to reply and for the info, as you say I might need to try a few before I find one I like",PenguinMum said: Hi Jayney Hi Jayney I have always preferred red wine. I like the lighter styles of Pinot Noir or Merlot. You might have to try a few before you find what you like. Pinot Noir from Marlborough New Zealand is particularly good but can be pricey. I look out for it on offers. Chilean merlots are also good. You need to experiment but I do think reds are generally a good choice. Click to expand...
20033,thread-159590,Would you give up meat,https://www.diabetes.co.uk/forum/threads/would-you-give-up-meat.159590/,Pinkorchid,"Dec 20, 2018",125,"3,239",post-1946179,EllsKBells,Type 1 Well-Known Member,363,318,123.0,"Dec 20, 2018 at 11:15 AM",1,4,0,0,0,0,0,0,#9,"I'm trying to - at the moment I'm only eating fish, and should probably stop that too, mostly for ethical/environmental reasons. Also, living by myself there isn't much point buying meat. It's a very personal decision, though. Can't imagine going vegan - need cheese, and milk for my tea! I do wonder if some people are put off, particularly veganism, by the 'proselytizing' (sp?) of some adherents. For instance, in Glasgow at the moment there are posters and adverts on buses about how cruel dairy is, taking calves from their mothers, and it just winds me up. If people are going to get to that point, they will make the decision themselves. Ramming it down their throats seems unlikely to acheive very much.",
80503,thread-124345,Vitamin K,https://www.diabetes.co.uk/forum/threads/vitamin-k.124345/,derry60,"Jul 31, 2017",20,"1,511",post-1522046,NoCrbs4Me,I reversed my Type 2 Well-Known Member,"3,692","9,088",198.0,"Jul 31, 2017 at 7:45 PM",0,0,0,0,0,0,0,0,#16,"Personally, I avoid all fruit/veg as I don't think they are good for one's health.",
137274,thread-86098,Someone help please,https://www.diabetes.co.uk/forum/threads/someone-help-please.86098/,Mia91,"Oct 18, 2015",21,"2,498",post-1007588,tim2000s,Type 1 Expert,"8,893","11,788",198.0,"Dec 11, 2015 at 3:15 PM",0,0,0,0,0,0,0,0,#22,And people wonder where Diabulimia comes from?,Elena1234 said: Apparently though insulin has weight gaining properties my daughters diabetic doctor told us. Click to expand...
52866,thread-27549,Vitamin D deficiency,https://www.diabetes.co.uk/forum/threads/vitamin-d-deficiency.27549/,Defren,"Mar 9, 2012",85,"16,921",post-255047,clearviews,Well-Known Member,389,7,38.0,"Mar 12, 2012 at 9:18 AM",0,0,0,0,0,0,0,0,#23,"I am passionate about supplementing with vitamin D3. The only irregular test results I had at diagnosis was D3 which was lower that desirable. I researched and chose to supplement. I do not believe that the RDA is good enough. I live in the Land Down Under where sunshine is plentiful. So why am I deficient? My skin doctor said to expose parts of my body that normally do not see the sun eg lower back, stomach etc............ I choose to suppement as sandflies and mossies are an issue here. My research tells me that 4000 ius is closer to the mark than 400 ius. Suffiency of Vit D helps with weight loss. My son who winters in Austria tells me that most winter athletes supplement with Vit D. Alison",
193059,thread-52888,Protien,https://www.diabetes.co.uk/forum/threads/protien.52888/,Dadio,"Feb 10, 2014",1,433,post-481106,Mud Island Dweller,Type 2 Well-Known Member,"1,161","1,486",178.0,"Feb 10, 2014 at 6:24 PM",0,0,0,0,0,0,0,0,#2,I have been working on what my PT told me 1 gram protein/kg bodyweight l think the front page here gives 1 gram protein/lb but you don't want to go over that amount. Should still leave a lot of leeway though. And even in Saudi should be other foods for a balanced diet. I would say the balance is the most important thing.,
