,thread_id,thread_title,thread_link,thread_author,thread_startDate,thread_replies,thread_views,post_id,post_username,post_userTitle,post_userNbMessages,post_userLikesReceived,post_userTrophyPoints,post_DateTime,post_like,post_agree,post_useful,post_funny,post_informative,post_friendly,post_optimistic,post_hug,post_number,post_messageText,post_quoteText
19768,thread-159611,Never felt so ill. Is it diabetes related??,https://www.diabetes.co.uk/forum/threads/never-felt-so-ill-is-it-diabetes-related.159611/,Steviechurch74,"Dec 21, 2018",7,466,post-1946890,Jaylee,Type 1 Expert,"9,111","8,587",198.0,"Dec 21, 2018 at 12:04 PM",0,0,0,0,0,0,0,0,#6,"Hi @Steviechurch74 , Well? An infection of this sort can raise BGs, which won't help how you feel, overall with the infection. Flu jabs are are recomended & you are entitled to one from the NHS. They tend to be for predicted strains of flu for the comming year? In my experience of yearly flu jabs without fail for as long as I can remember. It's not always a total ""barrier."" But It can help recovery quicker should the unfortunate happen.. Hope you recover quick. Regards, J>",
76351,thread-125744,Happy!,https://www.diabetes.co.uk/forum/threads/happy.125744/,connie104,"Aug 30, 2017",8,567,post-1548689,zand,Type 2 Expert,"8,757","15,184",198.0,"Sep 1, 2017 at 7:33 AM",1,0,0,0,0,0,0,0,#6,Oh Connie that's fantastic news! I'm really pleased for you.,
118294,thread-103891,Low carb side effects,https://www.diabetes.co.uk/forum/threads/low-carb-side-effects.103891/,KateWellsted,"Jun 30, 2016",12,771,post-1193756,KateWellsted,Prediabetes Member,8,1,23.0,"Jul 1, 2016 at 10:28 PM",0,0,0,0,0,0,0,0,#7,"nosher8355 said: Are you drinking enough water! Are you still eating too much? Have you increased your exercise? if you can! It is a personal thing, and you do have to find your own 'diet' lifestyle that suits you. You are eating all the right foods to lose weight, it probably just needs tweaking to get the balance right. Well done on getting your blood glucose levels down! Click to expand... Thanks, nosher8355 said: Are you drinking enough water! Are you still eating too much? Have you increased your exercise? if you can! It is a personal thing, and you do have to find your own 'diet' lifestyle that suits you. You are eating all the right foods to lose weight, it probably just needs tweaking to get the balance right. Well done on getting your blood glucose levels down! Click to expand... Thanks, i seem to be doing all the right things, lots of fluid, walk a lot etc, don't count calories, so may be eating too mch, but not sure I can eat less. I do have an underactive thyroid to add to the mix.","nosher8355 said: Are you drinking enough water! Are you still eating too much? Have you increased your exercise? if you can! It is a personal thing, and you do have to find your own 'diet' lifestyle that suits you. You are eating all the right foods to lose weight, it probably just needs tweaking to get the balance right. Well done on getting your blood glucose levels down! Click to expand... nosher8355 said: Are you drinking enough water! Are you still eating too much? Have you increased your exercise? if you can! It is a personal thing, and you do have to find your own 'diet' lifestyle that suits you. You are eating all the right foods to lose weight, it probably just needs tweaking to get the balance right. Well done on getting your blood glucose levels down! Click to expand..."
158645,thread-72145,Just diagnosed!,https://www.diabetes.co.uk/forum/threads/just-diagnosed.72145/,Sandrao,"Feb 16, 2015",26,"1,753",post-773544,Sandrao,Type 2 Active Member,33,46,58.0,"Feb 18, 2015 at 11:09 PM",0,0,0,0,0,0,0,0,#21,Thank you,
190248,thread-54759,Maths can't work this out,https://www.diabetes.co.uk/forum/threads/maths-cant-work-this-out.54759/,Lilliepop,"Mar 17, 2014",17,647,post-503958,Lilliepop,Well-Known Member,267,79,48.0,"Mar 17, 2014 at 4:00 PM",0,0,0,0,0,0,0,0,#5,You have totally lost me now hehe.,
178598,thread-61155,Strange Blood suagar,https://www.diabetes.co.uk/forum/threads/strange-blood-suagar.61155/,atalbot98,"Jul 10, 2014",19,"1,062",post-586286,atalbot98,Researcher Member,13,2,43.0,"Jul 10, 2014 at 9:37 PM",2,0,0,0,0,0,0,0,#15,Thanks Im going to be cutting down the sugar from my breakfast to only about 20g,
218935,thread-30699,What is the best fast food to eat?,https://www.diabetes.co.uk/forum/threads/what-is-the-best-fast-food-to-eat.30699/,SouthernGeneral6512,"Jun 23, 2012",34,"11,657",post-317791,Lenny3,Type 2 Well-Known Member,"1,010","1,331",178.0,"Oct 11, 2012 at 2:31 PM",0,0,0,0,0,0,0,0,#25,"If im having any kind of takeaway I go for an Indian with no naan or rice, popadums seem to be ok. Or I'll have a kebab with no pitta.",
195662,thread-51068,A Straight Answer,https://www.diabetes.co.uk/forum/threads/a-straight-answer.51068/,Adrien,"Jan 10, 2014",5,631,post-461389,Mongoose39uk,Type 2 Well-Known Member,495,223,103.0,"Jan 10, 2014 at 7:53 PM",0,0,0,0,0,0,0,0,#4,Time to make a trip to see your GP,
104651,thread-112593,Type 1. One drink hours before still over the limit?,https://www.diabetes.co.uk/forum/threads/type-1-one-drink-hours-before-still-over-the-limit.112593/,Anonymous Question,"Dec 5, 2016",9,950,post-1324425,therower,Type 1 Well-Known Member,"3,150","4,202",198.0,"Dec 5, 2016 at 6:41 PM",0,0,0,0,0,0,0,0,#10,"Definitely need to know what. "" one drink "" actually was. A vodka and Red Bull at home or a friend's could quite easily be a triple vodka.",
192347,thread-53236,Has anyone else here got diabetes and MS?,https://www.diabetes.co.uk/forum/threads/has-anyone-else-here-got-diabetes-and-ms.53236/,tarj01,"Feb 17, 2014",18,"1,467",post-487609,lwilliamson,Type 1 Member,9,2,43.0,"Feb 19, 2014 at 9:42 AM",0,0,0,0,0,0,0,0,#11,,DiamondAsh said: That must be so horrid for you. Oh my! I would never be able to cope with all that. You two sound very strong. Well done. Click to expand...
19918,thread-159569,How did this happen? (LDL lipids),https://www.diabetes.co.uk/forum/threads/how-did-this-happen-ldl-lipids.159569/,Bluetit1802,"Dec 19, 2018",24,755,post-1945844,Mr_Pot,Type 2 Well-Known Member,"2,480","1,224",178.0,"Dec 19, 2018 at 8:14 PM",0,0,0,0,0,0,0,0,#10,Except that it is about 10 times as big as a percentage. My theory is that the test was done at the same dodgy lab as @Bluetit1802 's HbA1c.,Guzzler said: Without NMR or ApoB100 tests (there may be no way of telling) but a 1mmol fall in TC may be a similar jobby to a 1mmol rise/fall in A1c in that the value is so small that it could be termed neglible. Something to watch alongside your other markers wrt the cohort tests done at review. Click to expand...
109797,thread-109731,HbA1c - good result........but,https://www.diabetes.co.uk/forum/threads/hba1c-good-result-but.109731/,carina62,"Oct 18, 2016",74,"11,041",post-1280870,Fionaerwin,Type 2 Member,18,2,23.0,"Oct 19, 2016 at 10:11 PM",0,0,0,0,1,0,0,0,#56,"The target graph is to encourage all registered with NHS Scotland to achieve the ""golden locks standard"" Your disdain for those professionals does you no credit The literature for all of this is in the GL book by Nigel Denby Your choice my needs have been addressed to my satisfaction","Jaylee said: Hi, I can see your results from June & July are portrayed in a ""traffic light"" graphics style with the ""Goldie Locks zone"" being the green centre.. I have no wish to ""diss"" your book. My genuine interest is the ""pee whispering"". ""Live streaming."" ""Wet nursing"".? I really don't know what this practice is called.. Do you have any literature or links to the technique? Thanks! Click to expand..."
184438,thread-41787,Treating the high after the low,https://www.diabetes.co.uk/forum/threads/treating-the-high-after-the-low.41787/,Isobel94,"May 22, 2013",24,"4,776",post-389159,LittleWolf,Well-Known Member,677,18,38.0,"Jun 1, 2013 at 11:42 PM",0,0,0,0,0,0,0,0,#18,"Well that sounds exactly like it Izzy! I have hardly any lows compared to when I was anorexic where Im sure I was hypoing (and my psychologist is convince this was the root of my mood swings etc) on a daily basis and yes, I would starve and starve and eat sugary things to keep myself going. That ON TOP of a vitamin D deficiency and family history may be why I am where I'm at now along with the Polycystic Ovary Syndrome... Having done a google search I've found 3 other ex anorexics now at normal weight or slightly under with T2 @_@ I went down to 9mmol from 19mmol in 8hours btw. Not nice because I felt like **** and hang eaten since the previous night obviously... Ack food!!! Such a shame about your aunt I'm hoping she turns out alright... I'm being careful... And missing grape juice! *sulk* Sent from the Diabetes Forum App",
84075,thread-120775,Statins and T2D,https://www.diabetes.co.uk/forum/threads/statins-and-t2d.120775/,RichardofYork,"May 14, 2017",50,"7,764",post-1490888,Indy51,Type 2 Expert,"5,229","6,146",178.0,"Jun 21, 2017 at 10:33 AM",2,2,0,0,0,0,0,0,#33,"Love your new profile pic, @bulkbiker",
135513,thread-90223,NHS Check Up Frequency,https://www.diabetes.co.uk/forum/threads/nhs-check-up-frequency.90223/,GordonAsh,"Jan 7, 2016",11,711,post-1025253,catherinecherub,Guest,,,,"Jan 7, 2016 at 10:29 AM",2,0,0,0,0,0,0,0,#9,If the ECG did not pick up any abnormalities then you would not require further investigations. Were you told that no intervention was necessary? The electrocardiogram ( ECG or EKG) is a diagnostic tool that is routinely used to assess the electrical and muscular functions of the heart.,
21001,thread-157345,type 2 and trigeminal neuralgia,https://www.diabetes.co.uk/forum/threads/type-2-and-trigeminal-neuralgia.157345/,lucylocket61,"Oct 13, 2018",23,"1,558",post-1899387,rochari,Type 1 Well-Known Member,99,166,73.0,"Oct 14, 2018 at 8:55 PM",0,0,0,0,0,1,0,0,#21,Please don't let it terrify you lucylocket61. I agree 100% with what Mel has said in her reply to you. Yours has been diagnosed early and there are now excellent treatments out there to help. Bill,"lucylocket61 said: I have to admit, the thought of being in such pain in my future terrifies me......... Click to expand..."
136781,thread-89241,new - is this diabetes?,https://www.diabetes.co.uk/forum/threads/new-is-this-diabetes.89241/,annette_williams,"Dec 16, 2015",8,"1,011",post-1011876,AloeSvea,Type 2 Well-Known Member,"1,257","1,570",178.0,"Dec 18, 2015 at 8:41 PM",2,0,0,0,0,0,0,0,#9,"But you are asking about the relationship between wine and diabetes aren't you? Wine is actually low carbohydrate - very, which is a positive thing for a recreational drink if worried about blood sugar levels. And, weirdly, alcohol can stop the liver dumping lots of glucose into the blood very early in the morning, which is a common problem for diabetics (it's due to a 'misreading' of the sugar in the blood signals) - as the liver is 'too busy' dealing with the alcohol! Those are the key features about wine in relation to diabetes. Alcohol drinking and health generally - now that's another issue! Which is what Shar and Nosher are talking to you about. If I was you, and worried about getting diabetes, due to having both parents diabetic (I am assuming T2?), I would be where you are - in this forum! Reading stuff that seems to apply. Good one! . And see yourself as someone with a very high chance of having inherited a high-carbohydrate intolerance, and lower the amount of carbs you may be eating, and drinking if you like sugary sodas/drinks. And make sure you are getting enough vitamin D3, magnesium and chrome in your diet. And see belly fat as a very real warning signal. ie if you have belly fat, or gaining it - take it seriously. (I just read 'Flat Belly Diet Diabetes' which I thought rather good.) (I say this, as I had big belly issues for the longest time, knew it was correlated with bad health - and felt really powerless about what to do about it. I had no idea about the role of carbs in that. And I would've liked the Flat Belly book at the time. So just in case the big belly thing applies to you.) Yeah - and get your blood tested every six months. (I personally am a test-case in point of someone who did NOT get enough blood tests done in what was obviously a key danger period! Pre-diabetes and diabetes proper can actually come on very fast in some circumstances.) And if I was you and worried about alcohol generally - yeah - go the 'going two or three days in a row without alcohol a week' number. That gives your liver time to clear out the alcohol in your bloodstream, it keeps a handle on any addiction issues that you might have, or might be developing (if you go three days without alcohol it is bound to put the role of alcohol in your life into focus! And then if you think that needs work - you can act on that.) I've had some seriously alcoholic friends who have done what the Swedes call 'white days' - ie have days in a row of no-alcohol, that has helped them keep a lid on their addiction. Just a lid mind - I have only seen the full AA number in American movies - where they give up alcohol entirely. But the lid can work wonders none the less - and makes sense if you are thinking about cutting down the number of bottles of wine consumed every week.","annette_williams said: My mum just been diagnosed and my dad had it before he died..I thought i would get tested because you never know and the chemist said it was high.I like a drink of wine and i was worried that has caused the high level,My dad died with alcohol related problems,my x husband died because of alcohol too at 43 and i am a bit paranoid.i have about 3/4 bottles of wine a week.?????????????? Click to expand..."
53937,thread-136166,suitable snack for on the move or at home,https://www.diabetes.co.uk/forum/threads/suitable-snack-for-on-the-move-or-at-home.136166/,lucydiabetic_,"Feb 18, 2018",23,"1,247",post-1702793,Resurgam,Type 2 (in remission!) Expert,"5,925","3,881",198.0,"Feb 19, 2018 at 3:54 PM",0,0,0,0,0,0,0,0,#21,"I got myself a bag of celery and some cream cheese last time I needed to find something to eat and there was no hot meat - not very warming on a cold day, but it was enough to tide me over until I got home near midnight.",
58274,thread-133175,Newly Diagnosed,https://www.diabetes.co.uk/forum/threads/newly-diagnosed.133175/,Sugarmouse 21,"Jan 24, 2018",17,830,post-1678353,daisy1,Type 2 Legend,"26,460","4,870",248.0,"Jan 24, 2018 at 4:59 PM",0,0,0,0,0,0,0,0,#15,"@Sugarmouse 21 Hello and welcome to the Forum Here is the Basic Information we give to new members and I hope you will find it useful. Ask as many questions as you want and someone will be able to help. BASIC INFORMATION FOR NEWLY DIAGNOSED DIABETICS Diabetes is the general term to describe people who have blood that is sweeter than normal. A number of different types of diabetes exist. A diagnosis of diabetes tends to be a big shock for most of us. Its far from the end of the world though and on this forum you'll find well over 235,000 people who are demonstrating this. On the forum we have found that with the number of new people being diagnosed with diabetes each day, sometimes the NHS is not being able to give all the advice it would perhaps like to deliver - particularly with regards to people with type 2 diabetes. The role of carbohydrate Carbohydrates are a factor in diabetes because they ultimately break down into sugar (glucose) within our blood. We then need enough insulin to either convert the blood sugar into energy for our body, or to store the blood sugar as body fat. If the amount of carbohydrate we take in is more than our bodys own (or injected) insulin can cope with, then our blood sugar will rise. The bad news Research indicates that raised blood sugar levels over a period of years can lead to organ damage, commonly referred to as diabetic complications . The good news People on the forum here have shown that there is plenty of opportunity to keep blood sugar levels from going too high. Its a daily task but its within our reach and its well worth the effort. Controlling your carbs The info below is primarily aimed at people with type 2 diabetes, however, it may also be of benefit for other types of diabetes as well. There are two approaches to controlling your carbs: Reduce your carbohydrate intake Choose better carbohydrates Reduce your carbohydrates A large number of people on this forum have chosen to reduce the amount of carbohydrates they eat as they have found this to be an effective way of improving (lowering) their blood sugar levels. The carbohydrates which tend to have the most pronounced effect on blood sugar levels tend to be starchy carbohydrates such as rice, pasta, bread, potatoes and similar root vegetables, flour based products (pastry, cakes, biscuits, battered food etc) and certain fruits. Choosing better carbohydrates The low glycaemic index diet is often favoured by healthcare professionals but some people with diabetes find that low GI does not help their blood sugar enough and may wish to cut out these foods altogether. Read more on carbohydrates and diabetes . Over 145,000 people have taken part in the Low Carb Program - a 10 week structured education course that is helping people lose weight and reduce medication dependency by explaining the science behind carbs, insulin and GI. Eating what works for you Different people respond differently to different types of food. What works for one person may not work so well for another. The best way to see which foods are working for you is to test your blood sugar with a glucose meter. To be able to see what effect a particular type of food or meal has on your blood sugar is to do a test before the meal and then test after the meal. A test 2 hours after the meal gives a good idea of how your body has reacted to the meal. The blood sugar ranges recommended by NICE are as follows: Blood glucose ranges for type 2 diabetes Before meals: 4 to 7 mmol/l 2 hours after meals: under 8.5 mmol/l Blood glucose ranges for type 1 diabetes (adults) Before meals: 4 to 7 mmol/l 2 hours after meals: under 9 mmol/l Blood glucose ranges for type 1 diabetes (children) Before meals: 4 to 8 mmol/l 2 hours after meals: under 10 mmol/l However, those that are able to, may wish to keep blood sugar levels below the NICE after meal targets. Access to blood glucose test strips The NICE guidelines suggest that people newly diagnosed with type 2 diabetes should be offered: structured education to every person and/or their carer at and around the time of diagnosis, with annual reinforcement and review self-monitoring of plasma glucose to a person newly diagnosed with type 2 diabetes only as an integral part of his or her self-management education Therefore both structured education and self-monitoring of blood glucose should be offered to people with type 2 diabetes. Read more on getting access to blood glucose testing supplies . You may also be interested to read questions to ask at a diabetic clinic . Note: This post has been edited from Sue/Ken's post to include up to date information. Take part in Diabetes.co.uk digital education programs and improve your understanding. Most of these are free. Low Carb Program - it's made front-page news of the New Scientist and The Times. Developed with 20,000 people with type 2 diabetes; 96% of people who take part recommend it... find out why Hypo Program - improve your understanding of hypos. There's a version for people with diabetes, parents/guardians of children with type 1, children with type 1 diabetes, teachers and HCPs.",
225349,thread-28063,cholesterol LDL levels and Low carbing.,https://www.diabetes.co.uk/forum/threads/cholesterol-ldl-levels-and-low-carbing.28063/,simply_h,"Mar 27, 2012",7,"1,369",post-259622,simply_h,Well-Known Member,193,24,38.0,"Mar 27, 2012 at 5:58 PM",0,0,0,0,0,0,0,0,#4,"Hello Borofergie, On training day about 100 to 120grams now, non training days around 60 to 80 grams. Cheers Simply_h",
95340,thread-117187,Machu Picchu inca trail,https://www.diabetes.co.uk/forum/threads/machu-picchu-inca-trail.117187/,pancreaticallychalenging,"Mar 2, 2017",4,463,post-1401587,carol43,Type 2 (in remission!) Well-Known Member,"1,004","1,220",198.0,"Mar 2, 2017 at 4:06 PM",0,0,0,0,0,0,0,0,#5,Can I come please.,
2269,thread-164782,Reversing type 2,https://www.diabetes.co.uk/forum/threads/reversing-type-2.164782/,Cana,"May 30, 2019",123,"4,779",post-2063385,Mr_Pot,Type 2 Well-Known Member,"2,480","1,224",178.0,"May 30, 2019 at 6:35 PM",1,0,0,0,0,0,0,0,#59,"This is assuming people developed diabetes by eating the wrong things. If you developed Type 2 due to some genetic reason, or if, as I suspect is the case with many people diagnosed late in life, their pancreas is ""wearing out"", then you are just in the controlled state rather than in remission, like someone with a peanut allergy who avoids peanuts.","Cocosilk said: If it takes the best part of someone's life to end up diabetic, once you reverse it by eating the right things, do those who go back to eating the wrong things end up diabetic much faster the next time around? Or only as fast as it took you to reverse it, perhaps? If you eat the wrong things for 40 years, then in a few months bring your levels back to pretty good with a low carb diet, it makes sense that if you started eating the wrong things again, it might only be a matter of months before you end up in trouble again, right? But if you eat the right things for the next 20 years, you might get away with eating more carbohydrates again, depending on which ones and how much of them. Has anyone proven this theory? I mean, are there any documented cases of some older folk who were eating carbs again after years of healing their bodies on low carb diets, for example? Click to expand..."
235296,thread-19418,best way to gain weight,https://www.diabetes.co.uk/forum/threads/best-way-to-gain-weight.19418/,sattie_c,"Feb 10, 2011",8,"2,339",post-177173,carty,Type 2 Well-Known Member,"3,017","1,920",178.0,"Feb 10, 2011 at 7:06 PM",0,0,0,0,0,0,0,0,#5,"Hi sattie I was diagnosed about 2 years ago and I can sympathise with you totally I had lost over 2 stone over about 2 and a half years i am struggling to put weight on and get my BGs lower Its my battle of the 7s I want my fasting levels below 7 and my weight above 7 stone I agree that it is a good idea to ask to see a dietitian I found it very helpful .I was advised to eat cheese cream full fat yoghurts in fact full fat anything :lol: She was very good about the carbs when I told her how they affected my BGs She suggested that the GP prescribe me Glucogen which is just a calorie drink Ihave the neural one that has no carbs it tastes like liquid lard :evil: I was also told that resi stance exercise would help to build up my weight to be honest Iam struggling with this but I do know that when I exercise my BGs come down .Snacks are good, nuts have lots of fat but low carb You just need to test .Dont lose heart it can be done .We skinnies can win :lol: CAROL",
207911,thread-41013,steroids and antibiotics,https://www.diabetes.co.uk/forum/threads/steroids-and-antibiotics.41013/,JIMDOG1,"May 12, 2013",5,"1,182",post-381307,JIMDOG1,Well-Known Member,92,0,26.0,"May 12, 2013 at 5:15 PM",0,0,0,0,0,0,0,0,#1,Hi folks I was put on steroids and antibotics yesterday afternoon for chest infection do these have an effect on bg readings today they seem high for what ive eaten this morning waking bg 4.9 + 1.30hrs breakfast time 5.5 then 3 slices of burgan toast with cheese and marmite not together tho lol +2.30hrs 8.2 +2hrs 9.6 +2hrs 8.3 this seems little high today as all ive had is breakfast and black coffee with hermetas sweetner and two pints of robinsons sugar free squash my avg for week since yesterday morning according to app is 6.56mmol/l Thanks :wave:,
243056,thread-17727,Was on Avandamet & now on Metformin - BG readings high,https://www.diabetes.co.uk/forum/threads/was-on-avandamet-now-on-metformin-bg-readings-high.17727/,rah2403,"Nov 9, 2010",1,528,post-160621,rah2403,Newbie,1,0,21.0,"Nov 9, 2010 at 12:28 PM",0,0,0,0,0,0,0,0,#1,Hi I'm new to these boards. I have had Type 2 for 15 years and have been on Avandamet for most of that time. Since it has been taken off the market I am now on 1gm Metformin twice a day. My BG readings in the morning have increased from 4.6/5 to 7.6+!! Anyone else got this problem. Maybe it's because I have only been on the Metformin for a month and there is a settling-in period. Ruth,
121440,thread-102121,Feeling confused - high readings,https://www.diabetes.co.uk/forum/threads/feeling-confused-high-readings.102121/,wayne84,"May 29, 2016",18,968,post-1167350,wayne84,MODY Member,12,2,43.0,"May 31, 2016 at 8:50 AM",0,0,0,0,0,0,0,2,#6,No the hospital just put me on drips till bloods come down then discharge me then bloods start rising again and my last reading last night was 32.0,
78380,thread-125144,Low-Carb Diet,https://www.diabetes.co.uk/forum/threads/low-carb-diet.125144/,Janjoy32,"Aug 17, 2017",10,786,post-1535988,bulkbiker,Type 2 Master,"12,684","9,684",298.0,"Aug 18, 2017 at 12:22 PM",1,1,0,0,1,0,0,0,#9,"Full-fat foods are there because fat means satiety so you don't get hungry so often and feel the need for snacks. It triggers no (or at least a very small) insulin response too which is great for someone with insulin resistance, We have I fear been led astray by incorrect dietary guidelines and bad information on cholesterol and heart disease. There is a lot of new science about how fat can help us loose weight.",Janjoy32 said: I am rather concerned that the recommended recipes contain full-fat foods. Click to expand...
